{
  "$schema": "./schemas/package.schema.json",
  "name": "user-management-1",
  "template": "user-management",
  "templateVersion": "0.1.0",
  "configuration": {},
  "deployments": [
    {
      "name": "prod",
      "awsUser": "goldstack-dev",
      "awsRegion": "us-west-2",
      "configuration": {
        "cognitoDomain": "auth-integration-1792968120467.dev.goldstack.party",
        "userPoolName": "integration-pool-1792968120467",
        "hostedZoneDomain": "dev.goldstack.party",
        "cookieDomain": ".dev.goldstack.party",
        "cookieSameSite": "None",
        "callbackUrl": "https://ssr.examples.templates.dev.goldstack.party"
      },
      "tfStateKey": "user-management-1-prod-054cbd57dfe6d2ce9124.tfstate"
    }
  ]
}